{
  "$schema": "../schema/piece.schema.json",
  "id": "rook",
  "name": "Rook",
  "letter": "R",
  "moves": [
    {
      "directions": [
        "orthogonal"
      ]
    }
  ],
  "squares": [
    {
      "type": "coast",
      "stop": false,
      "pass": false,
      "when": {
        "param": "coast.openToAll",
        "is": false
      },
      "notes": "coast.openToAll lifts this bar (S40)."
    },
    {
      "type": "center",
      "stop": false,
      "when": {
        "param": "center.occupants",
        "in": [
          "dragons",
          "dragons-and-sun-moon"
        ]
      }
    },
    {
      "type": "center",
      "pass": false,
      "when": {
        "not": {
          "param": "center.passThrough",
          "has": "rook"
        }
      }
    }
  ],
  "source": "Unverified seed (S10, 19 Oct 2026): from docs/RULES.md draft v0.2, ledger decisions D25, D28, D29, D30 and S34, and the owner's board images of 18 and 19 Oct 2026. S40 (24 Oct 2026): coast.openToAll lifts the Coast bar."
}
