{
  "$schema": "../schema/piece.schema.json",
  "id": "queen",
  "name": "Queen",
  "letter": "Q",
  "moves": [
    {
      "directions": [
        "forward",
        "backward",
        "forward-diagonal",
        "backward-diagonal"
      ]
    },
    {
      "directions": [
        "sideways"
      ],
      "squares": [
        {
          "type": "center",
          "pass": false
        }
      ],
      "notes": "Along rank 5 she never crosses e5: it is crossed only on the E file and the diagonals d4-f6 and f4-d6 (docs/RULES.md)."
    }
  ],
  "squares": [
    {
      "type": "void",
      "stop": {
        "param": "queen.canStandOnVoid"
      },
      "pass": {
        "param": "queen.canCrossVoid"
      },
      "notes": "queen.canStandOnVoid and queen.canCrossVoid replace queen.canEnterVoid (S40)."
    },
    {
      "type": "coast",
      "stop": {
        "param": "queen.canEnterCoast"
      },
      "pass": {
        "param": "queen.canEnterCoast"
      },
      "when": {
        "param": "coast.openToAll",
        "is": false
      },
      "notes": "coast.openToAll lifts this bar (S40)."
    },
    {
      "type": "center",
      "stop": false,
      "notes": "queen.voidCrossings: she passes over e5 only and never stops there."
    },
    {
      "type": "center",
      "pass": false,
      "when": {
        "not": {
          "param": "center.passThrough",
          "has": "queen"
        }
      }
    },
    {
      "type": "center",
      "pass": false,
      "when": {
        "param": "queen.voidCrossings",
        "is": "none"
      }
    },
    {
      "type": "coast-gate",
      "stop": false,
      "pass": false,
      "when": {
        "param": "queen.voidCrossings",
        "in": [
          "e5-only",
          "none"
        ]
      }
    },
    {
      "type": "ting-yang",
      "stop": false,
      "pass": false,
      "when": {
        "param": "queen.voidCrossings",
        "in": [
          "e5-only",
          "none"
        ]
      }
    }
  ],
  "source": "Unverified seed (S10, 19 Oct 2026): from docs/RULES.md draft v0.2, ledger decisions D25, D28, D29, D30 and S34, and the owner's board images of 18 and 19 Oct 2026. S14 (19 Oct 2026): split the moves so that rank 5 does not cross e5, as docs/RULES.md says. S40 (24 Oct 2026): the void rule reads queen.canStandOnVoid and queen.canCrossVoid; coast.openToAll lifts her Coast setting.",
  "notes": "Not expressed yet (engine features): the swap with her green pawn (queen.pawnSwap). Reading of queen.voidCrossings e5-only and none: a5 and i5 are closed to her, for stopping and crossing."
}
